{
  "schemaVersion": 1,
  "categories": [
    {
      "id": "outboard",
      "label": "아웃보드",
      "description": "EQ · 컴프레서 · 프리앰프 · 공간계"
    },
    {
      "id": "deep-dive",
      "label": "엔지니어 딥다이브",
      "description": "리비전 · 회로 · 모델별 비교"
    },
    {
      "id": "microphone",
      "label": "마이크",
      "description": "캡슐 · 지향성 · 배치 · 레코딩"
    }
  ],
  "series": [
    {
      "id": "classic-studio-gear",
      "label": "Classic Studio Gear"
    },
    {
      "id": "engineer-deep-dive",
      "label": "Engineer Deep Dive / Revision War"
    },
    {
      "id": "microphone-master-library",
      "label": "Microphone Master Library"
    }
  ],
  "bundles": [
    {
      "id": "classic-50-v4-ko",
      "title": "Classic Gear 50",
      "status": "planned",
      "productIds": [
        "audio-001",
        "audio-002",
        "audio-003",
        "audio-004",
        "audio-005",
        "audio-006",
        "audio-007",
        "audio-008",
        "audio-009",
        "audio-010",
        "audio-011",
        "audio-012",
        "audio-013",
        "audio-014",
        "audio-015",
        "audio-016",
        "audio-017",
        "audio-018",
        "audio-019",
        "audio-020",
        "audio-021",
        "audio-022",
        "audio-023",
        "audio-024",
        "audio-025",
        "audio-026",
        "audio-027",
        "audio-028",
        "audio-029",
        "audio-030",
        "audio-031",
        "audio-032",
        "audio-033",
        "audio-034",
        "audio-035",
        "audio-036",
        "audio-037",
        "audio-038",
        "audio-039",
        "audio-040",
        "audio-041",
        "audio-042",
        "audio-043",
        "audio-044",
        "audio-045",
        "audio-046",
        "audio-047",
        "audio-048",
        "audio-049",
        "audio-050"
      ]
    },
    {
      "id": "deep-dive-10-v4-ko",
      "title": "Engineer Deep Dive 10",
      "status": "planned",
      "productIds": [
        "audio-051",
        "audio-052",
        "audio-053",
        "audio-054",
        "audio-055",
        "audio-056",
        "audio-057",
        "audio-058",
        "audio-059",
        "audio-060"
      ]
    },
    {
      "id": "microphone-20-v4-ko",
      "title": "Microphone Master Library 20",
      "status": "planned",
      "productIds": [
        "audio-061",
        "audio-062",
        "audio-063",
        "audio-064",
        "audio-065",
        "audio-066",
        "audio-067",
        "audio-068",
        "audio-069",
        "audio-070",
        "audio-071",
        "audio-072",
        "audio-073",
        "audio-074",
        "audio-075",
        "audio-076",
        "audio-077",
        "audio-078",
        "audio-079",
        "audio-080"
      ]
    },
    {
      "id": "complete-80-v4-ko",
      "title": "Complete Audio Library 80",
      "status": "planned",
      "productIds": [
        "audio-001",
        "audio-002",
        "audio-003",
        "audio-004",
        "audio-005",
        "audio-006",
        "audio-007",
        "audio-008",
        "audio-009",
        "audio-010",
        "audio-011",
        "audio-012",
        "audio-013",
        "audio-014",
        "audio-015",
        "audio-016",
        "audio-017",
        "audio-018",
        "audio-019",
        "audio-020",
        "audio-021",
        "audio-022",
        "audio-023",
        "audio-024",
        "audio-025",
        "audio-026",
        "audio-027",
        "audio-028",
        "audio-029",
        "audio-030",
        "audio-031",
        "audio-032",
        "audio-033",
        "audio-034",
        "audio-035",
        "audio-036",
        "audio-037",
        "audio-038",
        "audio-039",
        "audio-040",
        "audio-041",
        "audio-042",
        "audio-043",
        "audio-044",
        "audio-045",
        "audio-046",
        "audio-047",
        "audio-048",
        "audio-049",
        "audio-050",
        "audio-051",
        "audio-052",
        "audio-053",
        "audio-054",
        "audio-055",
        "audio-056",
        "audio-057",
        "audio-058",
        "audio-059",
        "audio-060",
        "audio-061",
        "audio-062",
        "audio-063",
        "audio-064",
        "audio-065",
        "audio-066",
        "audio-067",
        "audio-068",
        "audio-069",
        "audio-070",
        "audio-071",
        "audio-072",
        "audio-073",
        "audio-074",
        "audio-075",
        "audio-076",
        "audio-077",
        "audio-078",
        "audio-079",
        "audio-080"
      ]
    }
  ],
  "products": [
    {
      "id": "audio-001",
      "number": "001",
      "slug": "001-pultec-eqp-1a",
      "title": "Pultec EQP-1A",
      "brand": "Pultec",
      "series": "classic-studio-gear",
      "category": "outboard",
      "subcategory": "EQ",
      "equipmentType": "EQ",
      "description": "패시브 EQ 회로와 저역 트릭을 실전 비교",
      "keywords": [
        "이퀄라이저",
        "equalizer",
        "보컬",
        "vocal",
        "드럼",
        "drums",
        "기타",
        "guitar",
        "베이스",
        "bass",
        "피아노",
        "piano",
        "브라스",
        "brass",
        "믹스 버스",
        "mix bus",
        "마스터링",
        "mastering",
        "방송",
        "broadcast"
      ],
      "htmlPath": "guides/outboard/001-PULTEC_EQP1A_MASTER_MANUAL_BLUEGEE_v4.html",
      "pdfPath": null,
      "coverImage": null,
      "status": "published",
      "featured": false,
      "relatedIds": [
        "audio-055"
      ],
      "bundleIds": [
        "classic-50-v4-ko",
        "complete-80-v4-ko"
      ],
      "createdAt": null,
      "updatedAt": null,
      "keywordSources": [
        {
          "keywords": [
            "보컬",
            "vocal"
          ],
          "chapterId": "tab-sources",
          "heading": "8. Male Lead Vocal"
        },
        {
          "keywords": [
            "드럼",
            "drums"
          ],
          "chapterId": "tab-sources",
          "heading": "1. Kick Drum (어쿠스틱  &  전자)"
        },
        {
          "keywords": [
            "기타",
            "guitar"
          ],
          "chapterId": "tab-sources",
          "heading": "2. Bass Guitar (일렉트릭 핑거/픽)"
        },
        {
          "keywords": [
            "베이스",
            "bass"
          ],
          "chapterId": "tab-sources",
          "heading": "2. Bass Guitar (일렉트릭 핑거/픽)"
        },
        {
          "keywords": [
            "피아노",
            "piano"
          ],
          "chapterId": "tab-sources",
          "heading": "12. Grand Piano / Upright"
        },
        {
          "keywords": [
            "브라스",
            "brass"
          ],
          "chapterId": "tab-sources",
          "heading": "14. Brass Section (트럼펫/트롬본)"
        },
        {
          "keywords": [
            "믹스 버스",
            "mix bus"
          ],
          "chapterId": "bg-listening",
          "heading": "믹스 버스 미세 조정과 리콜 확인"
        },
        {
          "keywords": [
            "마스터링",
            "mastering"
          ],
          "chapterId": "tab-family",
          "heading": "Mastering EQM-1A의 핵심 가치"
        },
        {
          "keywords": [
            "방송",
            "broadcast"
          ],
          "chapterId": "tab-sources",
          "heading": "17. Podcast / Voiceover (스피치)"
        }
      ]
    },
    {
      "id": "audio-002",
      "number": "002",
      "slug": "002-teletronix-la-2a",
      "title": "Teletronix LA-2A",
      "brand": "Teletronix",
      "series": "classic-studio-gear",
      "category": "outboard",
      "subcategory": "Compressor",
      "equipmentType": "Compressor",
      "description": "광학 압축 회로와 레벨링 운용을 실전 비교",
      "keywords": [
        "컴프레서",
        "압축",
        "보컬",
        "vocal",
        "드럼",
        "drums",
        "베이스",
        "bass",
        "믹스 버스",
        "mix bus",
        "방송",
        "broadcast"
      ],
      "htmlPath": "guides/outboard/002-LA2A_MASTER_REFERENCE_BLUEGEE_v4.html",
      "pdfPath": null,
      "coverImage": null,
      "status": "published",
      "featured": false,
      "relatedIds": [
        "audio-052"
      ],
      "bundleIds": [
        "classic-50-v4-ko",
        "complete-80-v4-ko"
      ],
      "createdAt": null,
      "updatedAt": null,
      "keywordSources": [
        {
          "keywords": [
            "보컬",
            "vocal"
          ],
          "chapterId": "bg-listening",
          "heading": "눈금이 아니라 GR로 첫 보컬 비교"
        },
        {
          "keywords": [
            "드럼",
            "drums"
          ],
          "chapterId": "tab-drums",
          "heading": "Drums  &  Mix Bus: 적합성과 한계점 분석"
        },
        {
          "keywords": [
            "베이스",
            "bass"
          ],
          "chapterId": "tab-vocal",
          "heading": "5. 중후한 남성 보컬 (바리톤/베이스)  저역 두께감 보존"
        },
        {
          "keywords": [
            "믹스 버스",
            "mix bus"
          ],
          "chapterId": "tab-drums",
          "heading": "Drums  &  Mix Bus: 적합성과 한계점 분석"
        },
        {
          "keywords": [
            "방송",
            "broadcast"
          ],
          "chapterId": "tab-history",
          "heading": "Jim Lawrence의 영감: 레이더, 광학 센서, 그리고 라디오 방송국"
        }
      ]
    },
    {
      "id": "audio-003",
      "number": "003",
      "slug": "003-1176-fet-limiter",
      "title": "1176 FET Limiter",
      "brand": "UREI / Universal Audio",
      "series": "classic-studio-gear",
      "category": "outboard",
      "subcategory": "Compressor",
      "equipmentType": "Compressor",
      "description": "FET 압축 회로와 어택·릴리스를 실전 비교",
      "keywords": [
        "컴프레서",
        "압축",
        "UREI",
        "Universal Audio",
        "UA",
        "보컬",
        "vocal",
        "드럼",
        "drums",
        "기타",
        "guitar",
        "베이스",
        "bass"
      ],
      "htmlPath": "guides/outboard/003-BLUEGEE_PLUGIN_MASTER_1176_v4.html",